{"requested_object_id":"BK-ENT-001","lineage_nodes":[{"node_id":"BK-ENT-001","node_type":"governed_object","source_asset_id":"BK-ENT-001","authority_status":"validated","lifecycle_status":"Validated","version":"1.0","valid_from":null,"valid_to":null,"provenance_reference":"enterprise-knowledge/banking/enterprises/lloyds/Lloyds-Enterprise-Twin.md"}],"lineage_edges":[],"unavailable_segments":[],"access_redacted_segments":["Restricted enterprise-specific evidence summary withheld from this fixture."],"completeness_status":"access_redacted"}
