{"requested_object_id":"BRH-003","lineage_nodes":[{"node_id":"SRC-zip-market-participant","node_type":"source","source_asset_id":"docs/Research/banking-market-participant-intelligence-release.zip","authority_status":"candidate","lifecycle_status":"archived","version":"sha256:849899f9a266e1b7f4dd32a53f40a49ed2739890c03df74fcc79e8f7d5b9143f","valid_from":null,"valid_to":null,"provenance_reference":"docs/Research/banking-market-participant-intelligence-release.zip"},{"node_id":"EVD-SDOC-1AAA2EF8E20A","node_type":"evidence","source_asset_id":"SDOC-1AAA2EF8E20A","authority_status":"candidate","lifecycle_status":"lineage_verified","version":"sha256:4722d93123498f79a8461b426ac614cefa7d6b4d08305f28a0264d021bade71d","valid_from":null,"valid_to":null,"provenance_reference":"banking-market-participant-intelligence-release/.../09-Opportunity-to-Participant-Analysis.md"},{"node_id":"BK-OBS-014","node_type":"observation","source_asset_id":"EK-BANK-RHYP-001","authority_status":"candidate","lifecycle_status":"accepted_for_runtime_display","version":"0.1","valid_from":null,"valid_to":null,"provenance_reference":"BRH-003 observation set"},{"node_id":"BRH-003","node_type":"governed_object","source_asset_id":"EK-BANK-RHYP-001","authority_status":"candidate","lifecycle_status":"Candidate","version":"0.1","valid_from":null,"valid_to":null,"provenance_reference":"enterprise-knowledge/banking/reinvention/Banking-Reinvention-Hypotheses-v0.1.md"},{"node_id":"proj-BRH-003-v0.1","node_type":"projection","source_asset_id":"EK-BANK-RHYP-001","authority_status":"candidate","lifecycle_status":"read_projection","version":"0.1.0","valid_from":null,"valid_to":null,"provenance_reference":"FocusObjectProjectionV0_1"}],"lineage_edges":[{"from":"SRC-zip-market-participant","to":"EVD-SDOC-1AAA2EF8E20A","edge_type":"contains"},{"from":"EVD-SDOC-1AAA2EF8E20A","to":"BK-OBS-014","edge_type":"supports_observation"},{"from":"BK-OBS-014","to":"BRH-003","edge_type":"informs"},{"from":"BRH-003","to":"proj-BRH-003-v0.1","edge_type":"projected_as"}],"unavailable_segments":[],"access_redacted_segments":[],"completeness_status":"complete"}
