{"requested_object_id":"BK-REF-001","lineage_nodes":[{"node_id":"BK-REF-001","node_type":"governed_object","source_asset_id":"BK-REF-001","authority_status":"validated","lifecycle_status":"Validated","version":"1.0","valid_from":null,"valid_to":null,"provenance_reference":"enterprise-knowledge/banking/industry/Banking-Mechanisms-and-Tensions-Model.md"}],"lineage_edges":[],"unavailable_segments":["Evidence and Observation nodes are not separately materialised in the source asset."],"access_redacted_segments":[],"completeness_status":"partial"}
